{"appliedCommand": "python3 -c 'import time; time.sleep(1.7)'", "artifacts": [], "attemptedCommand": "python3 -c 'import time; time.sleep(1.7)'", "callKey": "17eaffe11fb6f4f37e9481a0d8ea4facd0b1455ce7a6cd33fc7e7f3e834a808e", "createdAtNs": 1792152084397706000, "exitCode": 0, "identities": {"adapter": "4159e975c8bedf1c8c0ab300eae199a70f6de579f147d5596e2a7d358061fd33", "agent": "bff31dc42d6d1a99bf51291039d7719c6a48c2326e582e5e24eaa1eaf11e17ec", "compiledRules": "d30626189c4b7fc45439ade1426b18782bf2310fac84d4e2d117e0e92194b0fb", "guardRules": "f594d2295f27290d5239f2ac0d78808756994c92b83f550747dfc438220466ef", "roleConfig": "0e74e825932d2fd3879bc4390f1484535b1d273947b5b16d76cbe914f132b492", "settings": "c6e676cb4588c4e7c9b37bbc18013d72548c4666d82a29816a971847e8838a6e"}, "owner": "adb263ce-8e43-42d8-af02-6d0eab7c9f7d", "policySha256": "ffa09c37bd0b579073abce03073b350b4da3e9e26ba837861af0eb1a587f0650", "reason": null, "recordId": "c3c8fe8a-b999-4c16-aec7-8b8dbfb490d5", "schemaVersion": 1, "selectedOutputs": [], "state": "completed"}
