{"appliedCommand": "python3 validate_brief.py --check --output outputs/native-rewrite-warning-fixed.json", "artifacts": [{"bytes": 175, "path": "/private/tmp/terraphim-cursor-validation-20261016/public-project/outputs/native-rewrite-warning-fixed.json", "sha256": "3ea652ba31895fe613ecee845ffe9ab5ddef4343268eba26a954c177ad14bedc"}], "attemptedCommand": "python3 validate_brief.py --chek --output outputs/native-rewrite-warning-fixed.json", "callKey": "f8a84f9273f34383260c970a277a9eaf1c6e2ff1c0821755bf4a36bc5773644e", "createdAtNs": 1792151873068774000, "exitCode": 0, "identities": {"adapter": "4159e975c8bedf1c8c0ab300eae199a70f6de579f147d5596e2a7d358061fd33", "agent": "bff31dc42d6d1a99bf51291039d7719c6a48c2326e582e5e24eaa1eaf11e17ec", "compiledRules": "95c37b3013f53c38d259b6a4626bb8ef8b4544993d68006781ec8ffca4599b8a", "guardRules": "f594d2295f27290d5239f2ac0d78808756994c92b83f550747dfc438220466ef", "roleConfig": "5370fe22b055dc3d74b3e467e12bf8be5ff9928505edde14be45ecd7f39dcfcd", "settings": "c13be5bb4630fe67b081ddf127daeaafeab3b85af138786c9425942b9668799c"}, "owner": "1048b75b-9039-4136-9290-6e9aadc1c32c", "policySha256": "b379d4e03fdbd896a3b6d5877047f8d41499b34dbd5d3ce84bc2dda58cc0b605", "reason": null, "recordId": "4268adb7-b513-4552-a2cd-09f765db7188", "schemaVersion": 1, "selectedOutputs": ["/private/tmp/terraphim-cursor-validation-20261016/public-project/outputs/native-rewrite-warning-fixed.json"], "state": "completed"}
