{"appliedCommand": null, "artifacts": [], "attemptedCommand": "printf '%s\\n' 'reviewed warning-fixed guard probe'", "callKey": "7f4f34698ee823e50b5c0b55ae1f9c93c7f3ff48796d30c9967666a76a5316c7", "createdAtNs": 1792151959925744000, "exitCode": null, "identities": {"adapter": "4159e975c8bedf1c8c0ab300eae199a70f6de579f147d5596e2a7d358061fd33", "agent": "bff31dc42d6d1a99bf51291039d7719c6a48c2326e582e5e24eaa1eaf11e17ec", "compiledRules": "d5d1333d3f058ed709970535644cffa43264cdd5d4cee85e5f729464998461d6", "guardRules": "f594d2295f27290d5239f2ac0d78808756994c92b83f550747dfc438220466ef", "roleConfig": "ec4e186ee9b6a2f126495f6b9d00be1445bc239f7bf3f0c113492cca71e074c3", "settings": "1a780baa7e8af994ba2a9311ea57b34ca4cee53544213d944ebb5ee8224dac80"}, "owner": "8d1f7ae4-34f6-4251-9a0b-d7484baf893b", "policySha256": "86c3b3c1643213824e0548c747a2c7e2109630d9a2b7835b992c6be662911c40", "reason": "pretool_refused", "recordId": "c3069d00-697d-43da-af48-b418f0705eb6", "schemaVersion": 1, "selectedOutputs": [], "state": "denied"}
