{"appliedCommand": "python3 validate_brief.py --chek --output outputs/native-rewrite-off-warning-fixed.json", "artifacts": [], "attemptedCommand": "python3 validate_brief.py --chek --output outputs/native-rewrite-off-warning-fixed.json", "callKey": "38b3065106a7baa1b022ba3cdaecf567881a346e01e735ef5fbea0b2f4134615", "createdAtNs": 1792151917984449000, "exitCode": null, "identities": {"adapter": "4159e975c8bedf1c8c0ab300eae199a70f6de579f147d5596e2a7d358061fd33", "agent": "bff31dc42d6d1a99bf51291039d7719c6a48c2326e582e5e24eaa1eaf11e17ec", "compiledRules": "81b80c1e54b25b5102cdbaf7aafb838043c0d653672d66300979af2bba88bcdf", "guardRules": "f594d2295f27290d5239f2ac0d78808756994c92b83f550747dfc438220466ef", "roleConfig": "1b6ec6d191e03451fc5bf85c4cc189aaa9b2d9bd173932afccc258d42dce72ab", "settings": "7a96225e50e1c385605ff13e2f82277da63112a0ea50c0b76b5cc200164adf34"}, "owner": "2f805d70-ae13-456b-96c7-ec1c29aa1097", "policySha256": "7164f69b1478a4c282ba235eff1b5cc7066383b05c222c63fe66d500dfa9034e", "reason": "native_result_unqualified", "recordId": "c83a9224-5fa1-49ea-b696-3c51d85b9a8c", "schemaVersion": 1, "selectedOutputs": ["/private/tmp/terraphim-cursor-validation-20261016/public-project/outputs/native-rewrite-off-warning-fixed.json"], "state": "incomplete"}
