{"appliedCommand": "python3 validate_brief.py --check --output outputs/native-missing-post-warning-fixed.json", "artifacts": [], "attemptedCommand": "python3 validate_brief.py --chek --output outputs/native-missing-post-warning-fixed.json", "callKey": "3d6a7a8d3d142189641e09c6063efa3920a9e6f901541c49d181b1e42762e2e6", "createdAtNs": 1792152122545445000, "exitCode": null, "identities": {"adapter": "4159e975c8bedf1c8c0ab300eae199a70f6de579f147d5596e2a7d358061fd33", "agent": "bff31dc42d6d1a99bf51291039d7719c6a48c2326e582e5e24eaa1eaf11e17ec", "compiledRules": "4576500748b7dcb12d6a2fc865d927179539708741b441f8dd3b90eadcc1c8e3", "guardRules": "f594d2295f27290d5239f2ac0d78808756994c92b83f550747dfc438220466ef", "roleConfig": "1fe619e0c4e96232a8289846bb8f4c3d18aea1e0417e3ca5e891c7e6c3aa7ee1", "settings": "2dca61c7997a1d5dc1bc56c2ad5dbb2e506bdf699f267e6c9a8859c5f4149031"}, "owner": "e5d89b35-90ba-423e-b6eb-62bc33b39403", "policySha256": "9b318046e1446f1f73d082e76a5051bc21ef10c386240161928639990b0c0ce1", "reason": null, "recordId": "644d23ef-f578-4819-a74e-0a9c7b611d5e", "schemaVersion": 1, "selectedOutputs": ["/private/tmp/terraphim-cursor-validation-20261016/public-project/outputs/native-missing-post-warning-fixed.json"], "state": "applied"}
