{"appliedCommand": null, "artifacts": [], "attemptedCommand": "printf '%s\\n' 'rm -rf /'", "callKey": "e363582453f20adca2cf20c49c01f587fc2ffdbef47267b28d359a997ea77d1d", "createdAtNs": 1792151997682066000, "exitCode": null, "identities": {"adapter": "4159e975c8bedf1c8c0ab300eae199a70f6de579f147d5596e2a7d358061fd33", "agent": "bff31dc42d6d1a99bf51291039d7719c6a48c2326e582e5e24eaa1eaf11e17ec", "compiledRules": "d5d1333d3f058ed709970535644cffa43264cdd5d4cee85e5f729464998461d6", "guardRules": "f594d2295f27290d5239f2ac0d78808756994c92b83f550747dfc438220466ef", "roleConfig": "94b9cbe0fb550f081143d30f36b7fdbfbf558033dc7d0bb037062dcf03a7ddc2", "settings": "593a5637bc451e869650990e3bc2882b2726c926b8fc55201aab45279d1d6789"}, "owner": "bd3bba5f-74dd-4a84-a236-050149c092c6", "policySha256": "a6a6cc237fc88bf19cff6a59ba84d10ca3294e7867500d457428b46bd8c40f5e", "reason": "pretool_refused", "recordId": "7c4fea0f-5b97-48d7-9cdc-76405210cdfc", "schemaVersion": 1, "selectedOutputs": [], "state": "denied"}
